{
  "schema_version": "b0-g0-contract/v2",
  "contract_status": {
    "state": "approved",
    "freeze_prohibited": false,
    "approval_required": [],
    "approval_record": {
      "decision": "approved_by_project_administrator",
      "decision_date": "2026-10-10",
      "decision_source": "Project Administrator review communicated in task conversation",
      "baseline_commit": "046674dcb391983345a33d683331bcf2e155dcb1",
      "approval_package_commit": "ab2e6b05b2d51d851b1c3dfada5b69a66f47b9b0",
      "scope": "freeze the documented synthetic G0 candidate envelope and acceptance contract only; not a performance result",
      "ctl_applicability": {
        "CTL-REQ-001": "not_applicable_to_current_B0",
        "CTL-REQ-002": "not_applicable_to_current_B0"
      }
    },
    "approval_transition": {
      "current_version_action": "approved_successor_freezes_contract_without_mutating_v1",
      "approved_successor_schema_version": "b0-g0-contract/v2",
      "migration_rule": "create_new_versioned_configuration_and_validator_contract_do_not_mutate_approved_v1_in_place",
      "approval_record": "record_maintainer_decision_with_parameter_envelope_metric_and_CTL_applicability_rationale"
    }
  },
  "sources": [
    {
      "id": "ARCH-COORD-001",
      "kind": "repository",
      "status": "active_baseline",
      "locator": "07_docs/architecture.md; 07_docs/development_baseline.md",
      "use": "coordinate, unit, and B0 scope conventions"
    },
    {
      "id": "BASELINE-G0-001",
      "kind": "repository",
      "status": "active_work_order",
      "locator": "07_docs/work_orders/B0_work_order.md; 07_docs/work_orders/B0_G0_work_order.md",
      "use": "G0 lifecycle, truth isolation, and acceptance obligations"
    },
    {
      "id": "LIT-STATUS-001",
      "kind": "historical_literature_record",
      "status": "no_source_located_numeric_parameter_reused",
      "locator": "literature/evidence_matrix.xlsx#Studies; Evidence Extraction",
      "use": "audit only; not a numerical parameter authority"
    },
    {
      "id": "SYNTH-TIME-001",
      "kind": "synthetic_assumption",
      "status": "proposed_pending_maintainer_approval",
      "locator": "this configuration",
      "use": "base tick and integer-rate scheduling"
    },
    {
      "id": "SYNTH-PLANT-001",
      "kind": "synthetic_assumption",
      "status": "proposed_pending_maintainer_approval",
      "locator": "this configuration",
      "use": "rigid-body inertia and future G1 integration contract"
    },
    {
      "id": "SYNTH-ACTUATOR-001",
      "kind": "synthetic_assumption",
      "status": "proposed_pending_maintainer_approval",
      "locator": "this configuration",
      "use": "actuator lag, torque limits, and anti-windup signal"
    },
    {
      "id": "SYNTH-IMU-001",
      "kind": "synthetic_assumption",
      "status": "proposed_pending_maintainer_approval",
      "locator": "this configuration",
      "use": "IMU rate, gravity, noise, and bias envelope"
    },
    {
      "id": "SYNTH-CONTROL-001",
      "kind": "synthetic_assumption",
      "status": "proposed_pending_maintainer_approval",
      "locator": "this configuration",
      "use": "future controller gain bounds and initial candidates"
    },
    {
      "id": "SYNTH-SCENARIO-001",
      "kind": "synthetic_assumption",
      "status": "proposed_pending_maintainer_approval",
      "locator": "this configuration",
      "use": "scenario disturbances, windows, and proposed engineering gates"
    }
  ],
  "conventions": {
    "world_frame": "NED",
    "body_frame": "FRD",
    "units": "SI",
    "quaternion": {
      "name": "q_nb",
      "representation": "scalar_first_hamilton",
      "rotation": "body_to_ned",
      "normalization_required": true,
      "sign_policy": "canonical_scalar_nonnegative_then_first_nonzero_vector_positive",
      "unit_norm_tolerance": 1e-06
    },
    "body_angular_rate": {
      "name": "omega_b",
      "frame": "body_frd",
      "unit": "rad/s"
    }
  },
  "timing": {
    "source_ref": "SYNTH-TIME-001",
    "base_period_s": 0.0025,
    "schedules": {
      "plant_every_ticks": 1,
      "actuator_every_ticks": 1,
      "imu_every_ticks": 2,
      "estimator_every_ticks": 2,
      "controller_every_ticks": 2
    },
    "sequence": [
      "plant_consumes_held_actual_torque_for_interval_k",
      "actuator_advances_most_recent_published_torque_command_before_k",
      "imu_samples_interval_end_when_due",
      "estimator_consumes_imu_when_due",
      "controller_consumes_current_estimate_and_tagged_held_feedback_when_due",
      "controller_publishes_next_torque_command_when_due"
    ],
    "timestamp_policy": {
      "strictly_increasing": true,
      "nonpositive_dt_action": "reject_sample",
      "stale_timestamp_action": "reject_sample_preserve_last_valid_state",
      "reset_action": "clear_internal_state_publish_reset_command_and_begin_new_epoch_local_tick_zero"
    },
    "sample_consumption_policy": {
      "estimator_period_relation": "estimator_every_ticks_must_equal_imu_every_ticks",
      "estimator_no_new_imu_action": "not_scheduled",
      "controller_estimate_requirement": "consume_estimate_from_current_due_imu_sample",
      "controller_estimate_age_max_ticks": 0
    },
    "event_tick_semantics": {
      "start_tick": "inclusive",
      "end_tick": "exclusive",
      "event_order": "nondecreasing_start_tick_then_declaration_order",
      "same_signal_overlap": "reject",
      "allowed_cross_type_overlap_pairs": [],
      "command_after_event": "return_affected_axis_to_zero"
    },
    "first_due_tick": {
      "plant": 1,
      "actuator": 1,
      "imu": 2,
      "estimator": 2,
      "controller": 2
    },
    "reset_epoch_timing": {
      "epoch_zero": "scenario_start_and_each_runtime_reset_event_start_define_epoch_local_tick_zero",
      "reset_tick_action": "reset_only_no_plant_actuator_imu_estimator_or_controller_step",
      "schedule_phase": "restart_all_component_schedules_from_epoch_local_tick_zero",
      "timestamp_mapping": "scenario_clock_timestamp_s_equals_reset_boundary_s_plus_epoch_local_tick_times_base_period_s_never_rewinds"
    },
    "torque_command_hold": {
      "reset_command": "at_each_epoch_local_tick_zero_publish_zero_torque_command_with_scenario_clock_timestamp",
      "controller_publication": "at_each_due_controller_base_tick_timestamp_equals_scenario_clock_tick_times_base_period",
      "actuator_consumption": "at_base_tick_k_consume_most_recent_torque_command_published_strictly_before_k",
      "hold_between_controller_updates": "reuse_same_command_and_preserve_original_timestamp_without_synthetic_publication",
      "feedback_pairing": "actuator_feedback_tags_timestamp_of_the_command_actually_advanced",
      "startup_rule": "hold_reset_command_until_first_due_controller_publication_of_each_epoch"
    }
  },
  "interface_contract": {
    "source_ref": "BASELINE-G0-001",
    "numeric_type": "float64",
    "timestamp_unit": "s",
    "validity_encoding": "explicit_boolean_no_implicit_default",
    "messages": {
      "attitude_command": [
        {
          "name": "timestamp_s",
          "type": "float64",
          "shape": "scalar",
          "unit": "s",
          "frame": "scenario_clock",
          "validity": "finite_and_strictly_increasing"
        },
        {
          "name": "q_nb_command",
          "type": "float64",
          "shape": "length_4",
          "unit": "1",
          "frame": "body_to_ned",
          "validity": "unit_quaternion"
        },
        {
          "name": "valid",
          "type": "bool",
          "shape": "scalar",
          "unit": "bool",
          "frame": "not_applicable",
          "validity": "must_be_true_for_controller_step"
        }
      ],
      "imu_sample": [
        {
          "name": "timestamp_s",
          "type": "float64",
          "shape": "scalar",
          "unit": "s",
          "frame": "scenario_clock",
          "validity": "finite_and_strictly_increasing"
        },
        {
          "name": "gyro_b_rad_s",
          "type": "float64",
          "shape": "length_3",
          "unit": "rad/s",
          "frame": "body_frd",
          "validity": "all_finite"
        },
        {
          "name": "specific_force_b_m_s2",
          "type": "float64",
          "shape": "length_3",
          "unit": "m/s2",
          "frame": "body_frd",
          "validity": "all_finite"
        },
        {
          "name": "valid",
          "type": "bool",
          "shape": "scalar",
          "unit": "bool",
          "frame": "not_applicable",
          "validity": "false_means_reject_without_state_change"
        }
      ],
      "state_estimate": [
        {
          "name": "timestamp_s",
          "type": "float64",
          "shape": "scalar",
          "unit": "s",
          "frame": "scenario_clock",
          "validity": "finite_and_strictly_increasing"
        },
        {
          "name": "q_nb_estimate",
          "type": "float64",
          "shape": "length_4",
          "unit": "1",
          "frame": "body_to_ned",
          "validity": "unit_quaternion"
        },
        {
          "name": "omega_b_estimate_rad_s",
          "type": "float64",
          "shape": "length_3",
          "unit": "rad/s",
          "frame": "body_frd",
          "validity": "all_finite"
        },
        {
          "name": "valid",
          "type": "bool",
          "shape": "scalar",
          "unit": "bool",
          "frame": "not_applicable",
          "validity": "must_be_true_for_controller_step"
        }
      ],
      "actuator_feedback": [
        {
          "name": "timestamp_s",
          "type": "float64",
          "shape": "scalar",
          "unit": "s",
          "frame": "scenario_clock",
          "validity": "finite_and_strictly_increasing"
        },
        {
          "name": "command_timestamp_s",
          "type": "float64",
          "shape": "scalar",
          "unit": "s",